eprintid,keywords
1, 
2,health education; National Negro Health Week
3,
4,race; racism; health disparity
11,
12,HIV; HIV/AIDS; prevention; barriers; prisoners; males
13,Homeless; smoking characteristics; smoking cessation 
14,health policy; male; community-based; men of color; health care
15,
16,HIV; HIV testing; high risk populations; alternative HIV testing
17,Hepatitis A; Hepatitis B; Economic Assessment; Pre-Vaccination
18,National Public Health Performance Standards; Public Health
19, 
22,
23,
24,
25,
29,
34,
35,
36,
37,community outreach; African American; barbershop
38,health disparity men's health 
39,
40,Health Workforce; Health Disparities; Health Professions Schools; Health Care Professions
41,ethnic minorities; outreach; cultural understanding; health equality
42,Health Disparities; Bioethics; equal care
43,Organ Donations; Blacks; Tuskegee Syphilis Study
44,
45,
46,
47,health disparity; race; ethnicity
48,diversity; health professions; racial groups; ethnic groups; health disparity
49,health disparity; health professions; racial groups; ethnic groups
50,health disparity; health professions; racial groups; ethnic groups
51,
52,health disparity; racial groups; ethnic groups
53,health professions; health disparity; racial groups; ethnic groups
54,
55,health disparity; racial groups; ethnic groups; socio-economic status
56,Health disparity; racial groups; ethnic groups; NIH; National Institutes of Health; strategic plan; health disparities; elimination of health disparities
57,civil rights discrimination racism George W Bush disadvantaged groups underserved populations 
58,health; health care system;health science research; economic; social; health management
59,health services; Healthy People 2010; prevention; access; race/ethnic groups
61,health disparities; ethnic/racial groups; health care; research
62,health disparities; ethnic/ racial groups; health care
63,global; health disparities; research; training; health care; racial/ethnic groups
64,Health disparities; health care; racial/ethnic groups; research
65,
66,health disparities; minorities; racial/ethnic groups; health care
67,health disparities; research; minorities; NIH; National Institutes of Health; National Center for Research Resources
68,health disparities; vision; eye; research; minority; health education
69,health disparities; human genome; research; diverse populations; genetic variations; minority
70,health disparities; heart; lung; blood; minority; research
71,health disparities; aging; research; minority
72,health disparities; alcohol abuse; alcoholism; epidemiology; pychosocial; biomedical; research; racial; African-Americans; Hispanics/Latinos; American Indians/Alaska Natives; Asian Americans; Native Hawaiians; Pacific Islanders
73,health disparities; health care; allergy; infectious disease; ethnic; genetic; racial; African-American; Native American; research
74,health disparities; arthritis; musculoskeletal disease; skin disease; research 
75,health disparities; biomedical imaging; bioengineering; research
76,health disparities; child development; human development; research; racial; ethnic; adolescence; young adulthood
77,childhood obesity; dietary factors; social factors; environmental factors; healthy weight; parents; schools; media
78,health disparities; deafness; communication disorders; hearing impairment
79,health disparities; dental; craniofacial; oral; research; minorities; diversity
80,health disparities; diabetes; digestive diseases; kidney diseases; minority population; research
81,health disparities; drug abuse; drug addiction; ethnic minority populations; race; Blacks 
82,health disparities; environmental health sciences
83,health disparities; biomedical research; general medical sciences
84,health disparities; mental health; minority groups; underrepresented groups; research
85,health disparities; neurological disorders; stroke; research; minority health disparities
86,health disparities; nursing; research; cultural; ethnic; minority health
87,health disparities; minority
88,health disparities; AIDS; HIV; racial minorities; ethnic minorities
90,health disparities; behavior science; social science; research; minority populations
91,health disparities; research
92,health disparities; racial; ethnic; health insurance; health care workforce; health care professionals; research
93,health disparities; healthcare equality; Healthcare Equality and Accountability Act of 2003; minorities; racial; ethnic; Democrats; Senate; health care services
95,prostate cancer; screening; racial disparity; African American men; white men; American Cancer Society; 
96,Healthcare; healthcare professionals; Lations; AIDS; HIV; minority health; Minority Health Care Communications (MHCC); research; drug abuse; social concerns; psychiatric concerns
97,
98,
99,blacks; HIV; AIDS; nurses; research
100,
101,
102,George Board retirement
103,US Health Resources and Service Administration; HIV; AIDS; American Indians; Alaska Natives; Ryan White Comprehensive AIDS Resources Emergency (CARE) Act
104,heath care system; Arkansas; black; Hispanic; Asian; poor whites; distrust; doctors
106,HIV; AIDS; African Americans; Latinos; inner city; HIV protease inhibitors
108,HIV; AIDS; Arkansas; Arkansas AIDS Drug Assistance Program; Jefferson Comprehensive Care Inc; Minority Health Subcommitee; black; black doctors; public health officials; diabetes; cancer; sickle cell anemia; nicotine addiction
109,health care workers; minority; disadvantaged; students; recruitment
110,US Centers for Disease Control and Prevention; CDC; Crack cocaine; antiviral therapy; HIV; women; black
111,blood pressure screening; Center for Minority; barbershops; salons; lay health advisors; American Red Cross; health care professionals
112,race; genes; racism
119,Boyce; race
120,minority health; health disparity; black family
121,race; poverty; violence; chicago
122,minority health; overweight; obesity; Latino; black
123,health; black; health professionals
124,minority health; health disparities; North Carolina; NC; AmeriCorps
125,Latino; Hispanic; Minority Health; Diabetes; Media; Campaign; awareness; research; Caucasian; social marketing; Washington State; prevention; control
126,minority; recruitment; University of Nebraska Medical Center; Virginia Commonwealth University; Nebraska; Virginia; students; faculty; academic; research; opportunities
127,HIV; AIDS; testing; minorities; blacks; males; females; Indiana; Hispanics
128,minority health; Center for Minority Health; University of Pittsburgh; diabetes; hypertension; Healthy Black Family Project
129,minority health; blacks; American Indians; disease; preventable deaths; health insurance; care; health conditions; white; racial; ethnic groups; Wisconsin
130,minority health; University of Southern California; health disparities; healthcare
131,minority health; Chattanooga; Tennessee; black; white; health disparities; Hispanic; men; women
132,minority health; Nancy Jewell; Indiana Minority Health Coalition; health care disparities; racial; ethnic; minority groups
133,health care; disparity; economic; cultural; language barriers; Arkansas; Arkansas Minority Health Commission
134,American Public Health Association; minority health professionals; diversity; Sullivan Commission
135,African American; males; females; Caucasian; heart failure; heart disease; National Minority Health Month Foundation
136,Hispanics; non-Hispanics; health-care disparities; CDC; Centers for Disease Control; minority; health-care services
137,patient dropouts; intervention trials; study sample attrition
138,minority; health workers; racial; ethnic; health disparities; Sullivan Commission; health profession
139,children; overweight; Hispanics; physical activity
140,California; health disparities; racial; ethnic
141,acculturation; ethnic minorities; health behavior; behaviorism; culture
142,behvioral risk factor; environmental factors; allegheny county; white; African American
143,breast cancer; women; Samoans; mammogrphy; beliefs and attitudes; screening; Polynesian; Pacific Islanders
144,Blacks; media; AIDS
146,racial; ethnic; health disparities
147,racial disparities; Department of Veterans Affairs; VA; blacks; whites; prostate-specific antigen; PSA
148,racial; health disparities; US Department of Health and Human Services
149,alcohol abuse; alcoholism; Native American; child; children
150,measles; pre-schoolers; vaccinations; African American; Chicago; blacks; child; preschool; disease transmission; immunization; infant
151,social disparities; health; health care
152,Asian Americans; health care; ethnic groups; HMO; quality of care
153,disparities; health care; race; ethnicity; socieconomic status
154,Mexican; students; smoking
155,dietary guidelines; nutrients; calorie; weight management; physical activity; food groups; fats; carbohydrates; sodium; potassium; alcoholic beverages; food safety; eating patterns; food; Vitamin E; Iron; Calcium; Vitamin A; Dietary Fiber; Vitamin C
156,Black men; gay; bisexual; self-indentification; San Francisco
157,genetics; risk factors; child health; environment; lead exposure
158,colorectal cancer; screening; prevention; Latino Americans; Vietnamese American
159,statins; African Americans; cardiologists
160,African-American; churches; diet; dietary intervention
161,cataract; Asians; galactokinase deficiency; GALK; Osaka variant
162,hypertension; genetics; linkage
163,admixture mapping; African Americans; genetics; genes
164,minorities; NIH; allergy; infectious diseases
165,African American women; ethnically sensitive HIV interventions; health disparities; high-risk behavioral factors; HIV/AIDS
166,Black Papers; Allegheny County; Pittsburgh; blacks; African American
167,racial consciousness; racial identity; African American students; counselor race; counselor ratings; counselor preference
168,mouse allergen; inner-city asthma; particulate matter; Mus m 1.
169,head and neck carcinoma; racial differences; equal-access facility; mortality by race; sociologic factors affecting outcomes; cancer demographics.
170,hunger; hungry
171,
172,birth; birth weight-specific mortality; death; infant mortality; low birth weight; mortality; multiple births; regionalization; vital statistics
173,birth; birth weight-specific mortality; death; infant mortality; low birth weight; mortality; multiple births; vital statistics; ICD-10; year 2000 population
174,birth; birth weight-specific mortality; death; infant mortality; low birth weight; mortality; multiple births; vital statistics; International Classification of Diseases; 10th Revision; year 2001 populatiion
175,birth; birth weight-specific mortality; death; infant mortality; low birth weight; mortality; multiple births; vital statistics; revised populations
176,race; ethnicity; research subjects; research
177,genes; genetics; race; ethnicity; racial groups; ethnic groups
178,persons of color; health and health care gaps; minorities; white population
179,Bill Frist; Edward Kennedy; health disparities; Congress
180,demographics; age; sex; population; natality; morbidity; mortality; hospitals; nursing homes; drug and alcohol treatment
181,African American; research participation; trust; informed consent
182,African-Americans; churches; diet; cancer; cardiovascular disease
183,diet; intervention; African-Americans; churches; cancer; cardiovascular disease
184,minority faculty development; pipelines; advanced study
185,Bogalusa Heart Study; Coronary disease; Cardiovascular risk; Early indicators; Biracial health research.
186,African American; Family Heart Study; Risk factors; Coronary disease; Prevention.
187,Minority health; Research; Funding; NIH; EPSCOR
188,Cancer; Native Americans; Appalachian Populations
189,cardiovascular risk factors; Montana American Indians; diabetes; cardiovascular disease
190,prostate cancer; survival; population-based; men; mortality rate
191,American Public Health Association (APHA); Sullivan Commission; minority health professionals; shortage
192,bone mineral density; risk of inceident nonspinal fractures; black; white; women
193,biomedical research; race; genes; disease; ethnicity
194,cerebrovascular disorders; ethnic groups; risk factors; stroke classification
195,
196,Cervical cancer; Hmong women; prevention; mortality; traditional healers; biomedicine
197,disparity; race; ethnicity; asthma
198,sudden infant death syndrome (SIDS); infant mortality; black infants; California
199,HIV; HIV antiretroviral treatments; men; African American; Latino; white
200,LDL-cholesterol; proprotein convertase subtilisin/kexin type 9 (PCSK9); African American; European American; Hispanic; genetics
201,Chronic actinic dermatitis (CAD); HIV infection; Chinese males; African Americans
202,men; race; socioeconomic status; health; health care; Medicare; 65 years or older
203,health; community-based participatory research; public health research programs; trust; institutional racism
204,cigarettes; excise taxes; African Americans; tobacco control; morbidity; mortality; smoking-related diseases
205,American Public Health Association (APHA); Sullivan Commission on Diversity in the Health Workforce
206,masculine transformation; urban; low-income; African American males; fatherhood; intervention
207,minority; family history; African American; public health; black; genetic counseling; community outreach; health disparities
208,obesity; food preparation; mass production
209,obesity; health consequences; mortality
210,race; culture; mental health; disparity
211,health benefits; health insurance; underinsured; uninsured; health gap
212,HIV infection rates; racial/ethnic population; prison; African American; Latino; male inmates; peer education model; cultural competency
213,physical education; community-based; racial disparities; health; chronic disease; racial and ethnic minority; chronic disease; Lively Ladies; activity intervention; low-income
214,policy; racial and ethnic health disparities; health disparity
215,lynching
216,lynching; re-enactment
218,state policy; racial and ethnic disparities; policy interventions; minority health and health care; infrastructure; management; consistent racial/ethnic data collection; effective evaluation of disparities-reduction programs; culturally and linguistically competent health services; minority representation; health care workforce; health screening; access to services; expanded insurance coverage; state offices of minority health
219,
220,African Americans; Tuskegee study; medical mistrust; race differences; health disparities
221,African American; Tuskegee study; syphilis; public health; research; Tuskegee
222,disparity; cognitive ability; African American; Latino American; White American; Native American; Asian American
223,clinical trials; minority; participation; community involvement; coalition; Tuskegee study
224,African Americans; HIV/AIDS; conspiracy; government; mistrust
225,Commission to End Health Care Disparities; Health Care; disparities
226,disparities; patient; health care; patient-provider; racial; ethnic; language; concordance; health professionals; race-discordant relationships
227,Health Care; Preventive Services; Hispanics; Non-Hispanics; minority; morbidity; mortality
228,African Americans; HIV/AIDS conspiracy beliefs; condom use; condom attitudes
229,genetic testing; knowledge; attitudes; cancer risk; cancer; family history
230,Atlanta; Georgia; Black Men; Health; awareness; 100 Black Men of Atlanta
231,African American; prostate cancer; screening; prostate-specific antigen
232,hairdressing facilities; public health interventions; smoking policy
233,cosmotologists; diabetes; awareness; screening; African American women
234,health; black; African American; Tavis Smiley
235,uninsured; affordability; access; public programs; healthcare
236,minorities; health professions; Dr. Louis Sullivan; Senator Bob Dole; The Honorable Louis Stokes; Eric H. Holder; Jr; Dr. Jeanne Sinkford; Dr. Geraldine Bednash; Dr. Patricia Bagow; Marsha Clement; Dr. Luddy Bristow; Dr. Winston Pratt; Juliet Choy; Tom Peres; Milagro Batista; Dr. Elena Rios; Umberto Brown; Marguerite Johnson
237,sexually transmitted diseases; STDs; HIV; AIDS; African American; syphilis; gonorrhea; North Carolina; Durham County; barber; beautician; peer educator program; Project StraighTalk (PS); Durham County Health Department
238,
239,safety net hospital systems; underserved; unisured; low-income; racial/ethnic minorites; National Public Health and Hospital Institute; diabetes; diabetes management; disparites
240,carotid endarterectomy; blacks; Hispanics; stroke
241,CDC; Centers for Disease Control and Prevention; HIV research; black; Hispanic; prevention
242,minority; prescription drug gap; Medicare
243,community-based; disparities; community involvement; participatory action reseach (PAR); racial; ethnic; breast cancer; cervical cancer; health outcomes
244,Medigap supplemental coverage; Medicare; low-income; rural
245,low-income; minority; beneficiaries; Medicare; Medicare Advantage Plan
246,health policy; health disparities; determinants of health
247,community preventive services; health; disparities; Healthy People 2010; health promotion
248,limited English proficiency; Spanish; Russian; costs of health care; resource utilization; medical interpreters 
249,weight; overweight; obesity; adults
250,disparities; health care; evidence
251,hypertension; high blood pressure; risk factor; control rate
252,culture; politics; voluntary human research; human research; human research subjects; Tuskegee; Tuskegee study
253,African Americans; Stroke; ethnic group; risk factors; cardiovascular disease; age; gender; race; heredity; high blood pressure; cigarette smoking; sickle cell anemia
254,African American; Black; prostate cancer; screening; prostate-specific antigen
255,asthma; indoor air exposure; indoor air
256,carotid endarterectomy; blacks; Hispanics; African American; Latino; stroke
257,black Americans; African Americans; Tuskegee; Tuskegee study; Tuskegee syphilis study
258,
259,Human narcolepsy-cataplexy; sleep disorder; hypocretin (orexin) deficiency; Japanese; African Americans; blacks; White Americans; whites; caucasians
260,
261,urban; youth; Internet; health information; New York City
262,Minority Health Conference; University of Southern California; minority health disparities; Southern California; health care system
263,cytotoxic-T-lympocyte (CTL); Human Immunodeficiency Virus (HIV); African American; black; Caucasian; Hispanic; and Caribbean
264,African-Americans; concurrent partnerships; social context; sexual networks; HIV; racial disparity; black
265,coronary arteriographic; black; African American; coronary artery disease; risk markers
266,coronary artery calcification; black; white; African American; Caucasian; women; calcium; postmenopause
267,HIV testing; low-income; minority; women
268,physical activity; urban; midwestern; African American; black; women; cardiovascular disease; stroke
269,physical activity; urban; midwestern; Latinas; women; Latino women; cardiovascular disease; stroke; obesity; type-2 diabetes mellitus
270,lay health advisor (LHA); women; black; African American; North Carolina Breast Cancer Screening Program; mammogrpahy; mammogram
271,Healing; Community; Native Medicine; Nurses; Doctors; Indigenous People
272,state minority health policy report card; minorty health; health policy; policy; racial and ethnic health disparities; health disparities; racial; ethnic; minorities
273,language chasm; language; language-assistance; English proficiency; linguistic competence
274,cultural competence; health care disparities; racial/ethnic disparity
275,BiDil; race; race medicine; Food and Drug Administration (FDA); heart failure; disparities; African American; black
276,BiDil; policy; race; genetics; Food and Drug Administration (FDA); racial classification; discrimination; racial politics
277,cultural competence; diverse patient population; health care disparities; racial and ethnic minorities; cultural and communication barriers
278,cultural competence; health care; diverse populations; diversity; linguistics; linguistic competence
279,cultural competence; healthcare systems; cultural; linguistic; racial and ethnic disparities; quality of healthcare; interventions; services
280,Diabetes; cardiovascular disease; insulin resistance; antiplatelet; dyslipidemia; hypertension; myocardial infarction; acute coronary syndrome; revascularization
281,community-based participatory research; smoking; smoking cessation; Chinese Americans; smoking rate
282,Substance abuse and HIV/AIDS prevention; faith-based program; African-American adolescents; community-based participatory research
283,community-based research; barriers; recruitment; African Americans; black; health disparities; power-difference barriers; conceptual barriers; community advisory board; community-based participatory research
284,Take a Health Professional to the People Day; black; African Americans; Center for Minority Health; barbershops; beauty salons; health advice; health messages; lay health advocates
285,David Satcher; US surgeon general; health disparities; public health
286,health literacy; decision support interventions; race; decision making.
287,assessment tool; sexually transmitted disease (STD); communities at risk; racial disparities
288,PEG tube; dementia; time trends; end-of-life care
289,deregionalization; neonatal intensive care; urban areas
290,self-assessment tool; culturally and linguistically appropriate services; culturally appropriate services; linguistically appropriate services; public health; public health agencies
291,Communitybased; Community capacity; Health promotion; Disease prevention; African American; black
292,cancer genetics; risk communication; African American health; education; cultural sensitivity; genetic counseling; focus groups; Black health; African American; Black
293,genetic discrimination instrument development; racism and genetics; racism; genetics; health communication
294,diabetes; diabetes care managment; curriculum; family practice residency program; quaility of care; chronic illness; disease management; Improving Chronic Illness Care Model
295,diabetes; diabetes meanings; explanatory models; immigrant; Latinos; North Carolina; type 2 diabetes; Diabetes; Minority health; Latinos/Hispanic; Health beliefs; USA
296,
297,social support; Latino; disabled persons; Hispanic
298,metabolism; racial differences; gender differences; body composition; energy expenditure
299,Medicaid; health insurance; health status; health services
300,Asian; Pacific Islander; Women; Cancer Screening; access; Asian American; disparities
301,disasters; urban populations; health
302,HIV; AIDS; immunity; depressive symptoms; African American; women
303,disparities; quality improvement; federal policy; racial and ethnic disparities in health; federal policy levers
304,disparities; depression; primary care; African Americans; Latinos; ethnic minorities; blacks; Hispanics
305,cholesterol; mass screening; coronary disease
306,Disparities; Race; Workers’ Compensation; Low Back Pain; Disability; Black; African American; White; Caucasian
307,
308,disparities; patient experience; health care processes; patient-provider concordance; racial; ethnic; language
309,
310,
311,
312,
313,
314,disparities; smoking cessation; African American; black; White; caucasian; quit ratio
315,
316,
317,
318,
319,
320,
321,
322,
324,
325,
326,
328,
329,
330,
332,Rickets; Nutrition; Minorities; Nutritional; infant; African American; Black; cod liver oil; Alfred Hess Infant Health; Vitamin Deficiency
333,AIDS; Education; Prevention; HIV-testing; HIV testing; enzyme immunoassay (EIA) testing; EIA; enzyme; immunoassay; enzyme immunoassay
336,Health; Communication; Disparities; Education; Culture; Public Health Interventions; health disparities
338,Tuskegee; Syphilis Study; Tuskegee Syphilis Study
339,Tuskegee Syphilis Study; Tuskegee; Syphilis Study
340,Tuskegee Syphilis Study; Tuskegee; Syphilis Study
341,Tuskegee Syphilis Study; Tuskegee; Syphilis Study
342,Tuskegee Syphilis Study; Tuskegee; Syphilis Study
343,Tuskegee Pictures; Tuskegee Syphilis Study; Tuskegee Experiments; Syphilis Study 
344,Tuskegee Pictures; Tuskegee Syphilis Study; Tuskegee Experiments; Tuskegee; Syphilis Study
345,Tuskegee Pictures; Tuskegee; Syphilis Study; Documentation of Tuskegee Experiments; Tuskegee Syphilis Study
346,Tuskegee Pictures; Tuskegee; Syphilis Study; Documentation of Tuskegee Experiments; Tuskegee Syphilis Study
347,Tuskegee Pictures; Tuskegee; Syphilis Study; Documentation of Tuskegee Experiments; Tuskegee Syphilis Study
348,Tuskegee Pictures; Tuskegee; Syphilis Study; Documentation of Tuskegee Experiments
349,Tuskegee Pictures; Tuskegee; Syphilis Study; Documentation of Tuskegee Experiments; Tuskegee Syphilis Study 
350,Tuskegee Pictures; Tuskegee; Syphilis Study; Documentation of Tuskegee Experiments; Tuskegee Syphilis Study
351,Tuskegee Pictures; Tuskegee; Syphilis Study; Documentation of Tuskegee Experiments
352,Tuskegee Pictures; Tuskegee; Syphilis Study; Documentation of Tuskegee Experiments
353,Tuskegee Pictures; Tuskegee; Syphilis Study; Documentation of Tuskegee Experiments
354,Race; Health; Distrust; Research; Health; Practice; Methodologies; Outreach
355,
356,
357,
359,patient-physician relationship; disparities; health care; racial differences; patient satisfaction; cultural sensitivity; racial concordance; cultural competency; Black; African American; White; Caucasian; Hispanic; Latino; racial disparities
360,
361,
362,
363,
364,
