eprintid,keywords
3016,race/ethnicity; fast food; body mass index; socioeconomic factors 
3017,
3018,community change; neighborhood mapping; geographicinformation systems; resident perceptions
3019,Residential mobility; instability; Making Connections initiative; community-change; neighborhoods
3020,social and economic conditions; Making Connections (MC) initiative; minority groups; child poverty
3021,low-income urban neighborhoods; immigrant families
3022,Neighborhoods; Out-of-school time; Hierarchical linear models
3023,bonding social capital;low-income neighborhood;resident participation
3024,instability; relationships and household composition; Making Connections initiative
3025,families; children; household instability; householdcomposition; extended family members; non-relatives; Making Connections Survey; child wellbeing; economic stability 
3026,Making Connections
3027,Measurement of neighborhood; Making Connections survey
3028,Making Connections Cross-Site Survey
3029,
3030,Making Connections Cross-Site Survey
3031,Making Connections Cross-Site Survey
3032,Making Connections Cross-Site Survey
3033,Making Connections
3034,Making Connections neighborhoods
3035,adolescent health; child health; school health; social determinants of health; youth
3036,
3037,
3038,Race/ethnicity; childhood and adolescent obesity; disparities
3039, 
3040,health disparities; social determinants of health; African-American women; Percutaneous Coronary Intervention 
3041,socioeconomic health disparities; adequate housing; public health policy 
3042,
3043,access to healthy food
3044,Food desert; Food access; United States; Socioeconomic status; Race/ethnicity
3045,socioeconomic deprivation; vehicle availability; 
3046,access to food
3047,health equity; Affordable Care Act; race; ethnicity; U.S. Department of Health and Human Services
3048,diabetes; insulin resistance; African Americans; Jackson Heart Study
3049,smoking behaviors; smoking cessation;  cardiovascular risk studies
3050,African Americans; fast food restaurant (FFR) availability;  Jackson Heart Study
3051,snacking; urban; dietary quality; obesity; purchases
3052,Obesity; Disparities; School environment; Food outlet
3053,Affordable Care Act;  funding;  racial and ethnic health disparities; cultural competency
3054,Community-based participatory research; Cardiovascular diseases; Health behavior; Risk factors; Health disparities
3055,Community health workers; Hispanic; Mexican American; cardiovascular disease; randomized community trial; U.S.-Mexico border; community-based participatory research
3056,cardiovascular disease; African Americans; community-based faith settings
3057,
3058,
3059,socioeconomic status
3061,diabetes; ethnicity; quality-of-care measures
3062,Racial/ethnic disparities; cardiovascular disease; type 2 diabetes; veterans
3063,
3064,BMR; basal metabolic rate; DLW; doubly labeled water; EI; energy intake; IQR; interquartile range; MET; metabolic equivalent; PAL; physical activity level; RMR; resting metabolic rate; TEE; total energy expenditure
3065,CDA; community diabetes advisor; CHD; coronary heart disease; HPLC; high-performance liquid chromatography; PA; physical activityPAA; PA assessment
3066,Type 2 diabetes mellitus; African Americans; nurse case manager; community health worker 
3067,exercise; physical activity; African Americans; health disparities
3068,Ethnic groups; Exercise; Female; Intervention development; Nutrition
3069,
3070,
3071,African American - Black - Health behaviors - Attitudes - Stages of change 
3072,African Americans; Stages of change; Nutrition education materials; PEN-3; Nutrition curriculum; Women of childbearing age 
3073,youth; exercise; ethnic minority; African American; Black; Latino
3074,adolescents; children; diet interventions; minorities; obesity prevention; physical activity interventions
3076,obesity
3077,
3078,
3079,
3080,
3081,tobacco use; obesity; HIV; cancer disparity reduction; access to health care; racial health disparities in breast cancer and infant mortality
3082,HIV; African American MSM; racial and ethnic minorities
3083,HIV; men who have sex with men (MSM);  black MSM
3084,
3085,men who have sex with men (MSM); African American MSM; HIV
3086,Envision Prince George’s 
3087,community-based participatory research; power and privilege; racial and ethnic health disparities
3088,type 2 diabetes; rural Hispanics; community stakeholders; community-based participatory research
3089,Community-based initiatives; Pacific Island groups; cancer research; cancer disparities 
3090,
3091,disparities; race; ethnicity; health insurance; breast cancer
3092,health care disparities; patient navigation; outcome measures; health care reform
3093,Screening; Latinas; Health disparities; Mammogram; Clinical breast exam 
3094,Latina; Literature review; Quality of life; Breast cancer; Cancer survivorship 
3095,health disparities; mammography; Latinas; breast cancer 
3097,Vietnamese Americans; Health disparities; Survey 
3098,Mortality; Mortality ratio; Disparities; Immigration 
3099,birth weight; gestational age; neonatal mortality; fetal growth; race
3100,knowledge-gap hypothesis; communication infrastructure theory; community-based communication resources; African Americans; Latinos; community-based storytellers; chronic disease 
3101,breast cancer; screening; personalized medicine; mammography; Bayesian Belief Networks; machine learning; Gail model; risk assessment 
3102,
3103,
3104,racial/ethnic disparities 
3105,cancer; community; engagement; health disparities; research
3106,
3107,mass screening;colorectal neoplasms;Medicare/utilization
3108,
3109,Allostatic load; Health disparities; Puerto Ricans; Chronic diseases; Metabolic syndrome; USA
3110,allostatic load;health disparities;complexity theory;African American
3111,
3112,
3113,cervical cancer screening; health belief model; immigrants; ethnic minorities
3114,Cervical cancer; Hispanic; African-Americans; Public housing; Continuity of care
3115,Adherence; Annual Pap testing; Black and Hispanic women
3116,U.S. National Institutes of Health (NIH); race; ethnicity
3117,National Institutes of Health (NIH); research funding 
3118,Hmong; vulnerable populations; Health Belief Model; health promotion; Healthy People 2010; hypertension; culturally congruent care
3119,disease management; disparity; heart failure; hypertension 
3120,hypertension; blood pressure; health disparities; minority health; health behavior; exercise; diet 
3121,access to health care; disparities; chronic disease 
3122,
3123,nutrition examination survey; non-hispanic white; food frequency questionnaire; impaired glucose-tolerance; stress scale pss; united-states; physical-activity; perceived stress; national-health; us adults; allostatic load
3124,National Institutes of Health; NIH funding
3125,
3126,USA; Racial disparities; Obesity; Incarceration; Gender disparities; Prisons; Men
3127,childhood overweight and obesity; state variations; disparities; National Survey of Children's Health
3128,overweight; BRFSS; NHANES; prevalence
3129,Obesity; diabetes; American Indians
3130,diabetes; Native North Americans 
3131,
3132,Disparity; Ethnicity; Hispanic; Latino; Type 2 diabetes
3133,
3134,diabetes mellitus; insulin-dependent; minority groups; ethnicity; mortality; epidemiology; children; adolescents
3136,
3137,Human Capital;  Public Health; inequalities in health; health disparities; Race/Ethnicity; African-American or Black; Public Health and Prevention; Health Policy
3138,bioethics; Dr. John Cutler; syphilis; Presidential Commission for the Study of Bioethical Issues; Guatemala;  U.S. Public Health Service; experiments
3139,Robert Wood Johnson Foundation; Bridging the Gap program; physical activity; diet; weight outcomes; access to food; disparities in access;  obesity; youth
3140,Bridging the Gap; Robert Wood Johnson Foundation;  adolescents; alcohol; tobacco; illicit drug use; obesity children;  healthy eating; physical activity
3141,access to healthy food; racial/ethnic background; socioeconomic status; high school students; secondary schools 
3142,racial/ethnic background; socioeconomic status; overweight in adolescence
3143,race/ethnicity; socioeconomic status; body mass index (BMI);  minorities and low-socioeconomic status youth; overweight; obesity-related health conditions 
3144,Health disparities; Birth outcomes; African American health; Nutrition and health; Food markets; Structural violence
3145,Local food environment; Supermarkets; Racial disparities
3146,Food store availability; Race/ethnicity; Inner-city neighbourhood
3147,childhood obesity; food-store availability; inner city neighborhood
3148,Obesity; Body mass index (BMI); Neighborhood walkability; Food environment; Retail food outlets
3149,obesity; 
3150,energy density; energy cost; sugar; fat; economics
3151,Obesity; poverty; energy density; energy intake; food prices; diet cost; economics
3152,Health care reform; individual mandates; single-payer national health care plan
3153,Perinatal periods of risk (PPOR); Community health planning; Feto-infant mortality; Preconception health; Health disparities 
3154,
3155,race; racism; research
3156,race/ethnicity; socioeconomic; racial discrimination; social inequalities in health 
3157,
3158,healthcare disparities; 
3159,infant mortality; racial disparity
3160,
3161,African-American women; breast cancer; health disparity 
3162,access to care; health disparities; health insurance; survey data; race/ethnicity
3163,disparities; minorities; children; race; ethnicity; African Americans; Hispanics; Asians/Pacific Islanders; Native Americans; multiracial
3164,cultural; tailoring; ethnic minorities; disparities 
3165,
3166,health disparities; access to health care; diabetes; racial/ethnic minorities 
3167,Discrimination; Dosage; Drug administration; Ethnic groups; Pharmacotherapy; Prescribing; Race; Sex; Women
3168,
3169,Tobacco Dependence; SmokingCessation; Race/Ethnicity; Bupropion; NicotinePatch; Nicotine Replacement Therapy
3170,
3171,blacks; bupropion; randomized trials; smoking cessation; tobacco use disorder
3172,Access to health care; Advocacy; Built environment; Community coalition; Community engagement; Community health; Community organizing; Cultural competency; Health disparities; Minority health; Race & health; Community-based participatory research
3173,Measurement; health disparities; patient-physician communication; discrimination; minority health; socioeconomic status; acculturation
3174,
3175,
3176,
3177,
3178,
3180,
3182,
3183,Spanish Brief Religious Coping Scale; instrument development; cross-cultural validation; psychometrics; Mexican Americans; community health; survey design; Hispanic
3184,
3185,Dr. John Cutler; U.S. Public Health Service; Guatemala; syphilis
3187,
3188,
3189,breast cancer screening; mammography; health disparities; health belief model; health education; health promotion; interventions
3190,Ethnic; Racial; Disparities; Youth; Mental health; Minorities; Health care
3191,Evidence-based treatment; Evidence-based practice; Children; Minority
3192,disparities; behavioral health services; youth; race; ethnicity
3193,HIV; AIDS; MSM; Gay 
3195,Dr. John Cutler; Guatemala experiments; syphilis study
3196,Unintended pregnancy; Reproductive health; Disparities; Abortion; Demographics; United States
3198,
3199,smoking cessation; nicotine replacement therapy; disparities; race/ethnicity; African Americans; Latinos; Asian Americans
3200,
3201,
3202,
3203,
3204,Asian Americans; blacks; minority groups; health assessment; health surveys; vital statistics
3205,Dr. John Cutler; Guatemala; syphilis experiments
3206,
3207,
3208,
3209,
3211,racial and ethnic minorities; clinical research 
3212,
3213,
3214,biomedical research; decision making; diagnosis; healthcare disparities; prejudice; race; socioeconomic factors; students; medical
3215,
3216,
3217,
3218,
3219,
3220,Perceived social environmental stress; Perceived physical environmental stress; Residential stability; Urban health
3221,Racial disparities; Birthweight; Residential segregation; Multilevel modelling; African-American; USA
3222,
3223,Neighborhoods; Physical activity; Socioeconomic disparities; Racial disparities; Physical environment; Social environment
3224,
3225,
3226,
3227,
3228,
3229,
3230,
3231,high blood-pressure; nutrition examination survey; decision support system; association council; national health; United States; prevalence; medications; prevention; guidelines 
3232,
3233,abdominal obesity; adiposity; adolescents; body mass index; waist circumference 
3234,racial/ethnic disparities; decision making; health care surveys; patient-provider communication; patient participation 
3235,Urban; Health inequity; Governance; Participation; Intersectoral action; Evidence 
3236,
3237,Economic resources; Environment; Equity; Social determinants; Urban health 
3238,
3239,congestive heart failure; black and white; African Americans; physicians; race; genetics; impact; perceptions; generalist; infarction 
3241,recruitment; African American; genetics; multigenerational; health disparities
3242,
3243,
3244,
3245,Access; utilization; racial; ethnic disparities; health insurance; Hispanic; African American
3246,
3247,Genetic differences; prostate cancer; disparities; African-American men
3248,
3249,
3250,
3251,Hypertension; Trust; Disparities
3252,blood pressure; hypertension; race; disparities
3253,blood pressure; chronic stress; discrimination; ethnicity; hypertension; neighborhoods; race
3254,Race; ethnicity; hypertension; hypertension control; MESA
3256,
3257,African Americans; American; Indians; Asian Americans; Blood Glucose; Self Monitoring; Diabetes; Hispanic; Latino;Mexican Americans; Non-Hispanic Whites; Review
3258,African Americans; genes; tobacco use
3259,Health Status; Hispanics; Screening
3260,African Americans; Depression; Rural Population; Type 2 Diabetes Mellitus
3261,High Socioeconomic Status; Prematurity; Race; Very Low Birth Weight
3262,African American; Hypertension;Qualitative Study
3263,Hypertension; Life-Course;Obesity; Poverty; Racial Disparities; Stress; Weathering; Women’s Health
3264,Blacks; Cardiovascular Health; Hypertension; Minorities; Physical Activity
3265,African American Women; Blood Pressure; Exercise
3266,African Americans; ComplementaryAlternative Medicine; CongestiveHeart Failure; Health Related Quality of Life;Stress; Transcendental Meditation
3267,Adolescents; Blood PressureMonitoring; Meditation; Hypertension; SodiumHandling; African American; Clinical Trials
3268,African American; DietaryKnowledge; Perceptions; Beliefs; Behavior;Cardiovascular Disease
3269,blood pressure; diet therapy; blacks; cardiovascular disease risk
3270,
3271,hypertension; Hispanic; Latino; non-pharmacologic interventions; blood pressure control; weight loss; DASH dietary pattern; lifestyle intervention
3272,trial; obesity; Hispanic
3273,obesity; body mass index; physical activity; Hispanic Americans; randomized controlled trial
3274,social influences; body mass index; obesity; Hispanic Americans
3275,Health Disparities; Concept Mapping; Community Dialog; Jackson; Mississippi
3276,racism; 
3278,bioethics; Guatemala; syphilis; sexually transmitted diseases 
3280,Health Care Reform; Health Equity; Health Promotion
3281,
3282,
3283,
3284,Tobacco; Social disparity; Smoking; Risk factorsTobacco; Social disparity; Smoking; Risk factors
3285,
3286,
3287,
3288,
3289,racial-differences; access
3290,randomized clinical-trials; black-white differences; united-states; socioeconomic-factors; racial-differences; stage-i; radiation-therapy; adjuvant breast; survival; race 
3292,
3293,Tuskegee Syphilis Study; biomedical research
3294,Stroke; Race; Mortality; Hospital;Outcomes
3295,racial/ethnic disparities; transition of care; adolescents; special health care needs
3296,Children with special health care needs; Youth with special health care needs; Medical home; Transition; Health disparities; Racial disparities; National survey of children with special health care needs; Adequate insurance; Education; Cultural validity 
3297,
3298,
3299,
3300,women’s health; myocardial infarction; minority groups; cluster analysis
3301,health care system; Affordable Care Act; disparities
3302,health disparities; minority communities; Health Equity and Accountability Act;  gay and transgender people of color; health equity 
3303,Psychosocial stress; health disparities; allostatic load; oxidative stress
3304,
3305,
3306,Breast cancer - Racial and ethnic disparities - Mammography - Stage 
3307,breast cancer; psychosocial stress; tumor progression; 
3308,Disparities; minority; African American; Latino; black; Hispanic; policy; marketing
3309,Disparities; Determinants Of Health; Minority Health
3310,Disparities; Health Reform; Safety-Net; Systems; Minority Health; Health Equity
3312,Determinants Of Health; Disparities; Environmental Health; Health Promotion/Disease Prevention; Health Spending
3313,Disparities; Minority Health; Public Opinion
3314,Determinants Of Health; Disparities; Environmental Health; Minority Health; Health Promotion/Disease Prevention
3315,Consumer Issues; Disparities; Minority Health; Access To Care
3316,Access To Care; Disparities; Information Technology; Minority Health; Organization and Delivery of Care
3317,Minority Health; Determinants Of Health; Disparities; Health Spending; Employer-Based System
3318,Disparities; Minority Health; Public Opinion; Quality Of Care
3319,Disparities; Cost Of Health Care; Determinants Of Health; Quality Of Care
3320,Determinants Of Health; Disparities; Public Health; Health Philanthropy; Minority Health
3321,Disparities; Health Reform; Insurance; Managed Care; Determinants Of Health
3322,Access To Care; Disparities; Minority Health; Organization And Delivery Of Care
3323,Disparities; Chronic Care; Minority Health; Health Reform; Hospitals
3324,Organization And Delivery Of Care; Special Populations; Disparities; Health Spending; Minority Health
3325,Access To Care; Trauma; Disparities; Quality Of Care; Rural Health Care
3326,Cost Of Health Care; Disparities; Quality Of Care
3327,Special Populations; Minority Health; Determinants Of Health; Disparities
3328,Disparities; Cost Of Health Care; Determinants Of Health; Quality Of Care
3329,Access To Care; Disparities; Public Health; Minority Health
3330,Disparities; Quality Of Care
3331,Disparities; Minority Health; Public Health; Health Promotion/Disease Prevention; Health Reform
3332,Disparities; quality improvement; minority health; race/ethnicity; access; disease management; data collection
3333,Data collection;ethnic groups/statistics and numerical data; quality of health care; health policy; qualitative research
3334,healthcare; interventions; racial disparities; socioeconomic disparities
3335,health disparities; health care inequality
3336,health disparitiesrace/ethnicityresearch
3337,population health; ecological model; excess deaths
3338,disparities; health; ethnicity; race; culture
3339,evaluation; data; health disparities; research; program; evaluation; health policy; health education; health inequitieshealth inequalitiesmonitoring
3340,African American; health disparity; culture; power gender
3341,tobacco control; policy; advocacy; disparities; empowerment; youth; high school students
3342,transdisciplinary; disparities; health
3343,health disparities; health education research; SOPHE’s health education research agenda; transdisciplinary research
3344,accessibility; health disparities; health equity; health literacy; people with access needs; universal design; universal design for learning
3345,Health Disparities; Minority Health; Healthcare Services Utilization
3346,
3347,
3348,
3349,
3350,
3352,
3353,Health disparities; Racial discrimination; Oxidative stress; Accelerated aging
3354,
3355,
3356,African Americans; Blacks; Ethnicity;High Blood Pressure; Hypertension;Minority Health; Prejudice; Race; Racial Discrimination;Racism; Stress
3357,
3358,structural equation modeling;emotion-focused coping;chronic stress emotions;racism;hypertension
3359,racism; hypertension; stress; emotions
3360,structural equation modeling;emotion-focused coping;chronic stress emotions;racism;hypertension
3361,African continental ancestry group; discrimination (psychology)hypertension; prejudice; sex factors; stress
3362,ambulatory blood pressure; racism; discrimination; cardiovascular disease; ecological momentary assessment; hypertension 
3363,racism; discrimination; blood pressure; ambulatory monitoring
3364,African American; culture; collective identity;              hypertensionself-care; Theory of Planned Behavior
3365,prejudice; racism; African American women; qualitative research
3366,Pulse Pressure; Race/Ethnicity; Sex
3367,Depression; Hispanic; Diabetes
3368,African Americans; Diabetes;Empowerment; Patient Educator
3369,African-Americans; Type 2 diabetes; Randomized trial; Nurse case manager; Community health worker; Interventions
3370,
3371,
3372,racial/ethnic disparities;socioeconomic status;workforce diversity
3373,African Americans; Discrimination;Professional Patient Relations
3374,
3376,
3377,African Americans; genetics; G-proteins; first-generation African immigrants
3378,health service use; minority groups; neighborhoods; health disparities 
3379,Provider Discrimination; Health Status; Health Disparities; Utilization
3380,African Americans; ecological theory; qualitative; USA
3381,social capital; HIV prevention; rural communities; African Americans; community-based participatory research 
3382,Infant mortality; low birthweight; preterm delivery; health disparities; racism; stress; African American; pregnancy
3384,race; racism; racial disparities; infant mortality; birth outcomes; pregnancy
3386,Preterm birth; Racial disparity; Residential segregation; Bayesian modeling; Social determinants; USA 
3387,race; health; socioeconomic status; racism; migration 
3388,
3389,socioeconomic status and health;race and health;genetics;social factors and health;migration and health
3390,black and white; racial discrimination; system justification; blood pressure; disparities; inequality; adults 
3391,blood pressure; hypertension; psychosocial factors; Race/ethnicity; social support
3392,African Americans; Premature birth; Relative income; Neighborhood; USA; Women 
3393,
3394,Diabetes risk; Gestational diabetes mellitus; Longitudinal follow-up; Racial/ethnic difference 
3395,
3396,Health equity; Disparities; Social entrepreneurship 
3398,
3399,Disparities; quality of care; diabetes
3400,
3401,
3402,
3403,rehabilitation services; vocational rehabilitation; employment; cultural diversity; multicultural issues; policy
3404,
3405,
3406,
3407,
3408,
3409,environmental; environmental justice; ethnicity; framework; health disparities; psychosocial; race; review; stress
3410,
3411,Community-based; fruits and vegetables; African American women
3412,Diet; Intervention Study; Lifestyle; Obesity; Weight Loss
3413,African Americans; Blood Pressure; Polymorphism; Population Stratification
3414,Hypertension Knowledge; Differential Item Functioning; Disparities
3415,Hypertension; African Americans;Health Disparities; Health Literacy; Qualitative Research; Chronic Disease Prevention
3417,Diabetes Mellitus; Type 2;Obesity; Body mass index; Risk factors; Ethnicgroups; Logistic models; Asian Americans; Pacific Islanders
3418,
3419,
3421,health disparities; segregation; community development; ecosystems; salutogens
3422,
3423,
3424,
3425,
3426,
3427,faith-based intervention; breast cancer; cervical cancer; African American women
3428,Class;Epidemiological catchment area; Geography; Psychological distress; Race
3429,
3430,
3431,
3432,
3433,
3434,
3435,Affordable Care Act
3436,
3437,lifestyle change; work site; workplace policy; practice; physical activity; nutrition; exercise; community-based participatory research
3438,Group processes; Mediation; Physical activity; Nutrition; African Americans; Hispanic Americans 
3439,
3440,
3441,
3442,
3444,access; use; race; ethnicity; health insurance; income
3445,health care disparities; segregation; minority health
3446,
3447,racial disparities; medical expenditure; trends; statistical adjustment for health status
3448,
3449,
3450,
3451,
3452,
3453,
3454,
3455,childhood obesity; health risk appraisal; minority health; parent health awareness
3456,
3457,
3458,breast carcinoma; minority and medically underserved communities; health disparities; racism; institutionalized racism
3459,race/ethnicity; uninsured; health insurance; employment-related health insurance
3460,African-American women; obesity; depression; physical activity; diet; fitness; acculturation; ethnic identity
3461,
3462,
3463,
3464,
3465,
3467,
3468,ethnic groups; health promotion; breast neoplasms; cervix neoplasms
3469,
3470,
3471,Minorities; Women; Clinical Research; Recruitment
3472,
3473,Indian Health Service (IHS); social determinants of health
3474,
3475,
3476,
3477,
3478,attitudes; cancer pain; pain management; minority; Hispanic; African-American
3479,
3480,Ethnic Minorities; Cancer Research; African Americans; Asian Americans; Hispanics; Native Americans; Native Hawaiians; Pacific Islanders
3483,
3484,research subjects; clinical research; research administration; gender; minority
3485,
3486,Recruitment; Minority populations; Principal investigators
3488,
3489,African Americans; cancer; incentives; Internet; mail; recruitment; telephone; surveillance
3490,
3491,Minority Recruitment; Cancer Prevention Trials
