eprintid,keywords
1232,Access to Care; African American; Asian; Attitudes and Health; Cross-Cultural Communications; Cultural Competence; Cultural Diversity; Effective Communication; Latino; Medical Education; Multi-Cultural; Physician-Patient Relationship; Racial and Ethnic Disparities; United States
1233,Healthcare System; Health Insurance; Healthcare Policy; under-served and elderly populations; African Americans
1234,African American; Confirmatory Factor Analysis; Depression Symptoms; Measurement; Psychometrics
1235,Apolipoproteins E; Cognition; Gene Frequency; Racial Groups
1236,Depression; Discrimination; Hispanic; Immigrants; Racism; Sleep
1237,Medical History Taking; Pregnancy; Racial Disparity; Substance Abuse Detection
1238,American Indians; Smoking Cessation
1239,Thiazolidinediones; Diabetes
1240,African Americans; Coronary Artery Disease; Ethnicity; Hispanics; Race
1241,Black Men; High Blood Pressure; Stressful Life Events
1242,Ethnicity; Hispanics; Non-Hispanics; Race; Self-Reported Hypertension
1243,African-American Women; Barriers; Obesity; Physical Activity
1244,Diabetes Mellitus; Heart Disease; New Mexico; Premature Mortality
1245,Perceived Racism; Racism; Racial Discrimination; Stress
1246,Diabetes; Disparities; Hospitalizations
1247,Cardiovascular Diseases; Computerized Medical Records Systems; Health Care Quality Assurance; Health Care Quality Indicators; Racial Differences
1248,African Americans; Behavioral Interventions; Cardiovascular Diseases; Compliance; Hypertension; Type 2 Diabetes
1249,High Blood Cholesterol; High Blood Pressure; Race; Risk
1250,Maternal Influence; Obesity; Physical Activity; Psychosocial Values and Beliefs; Sociodemographic
1251,African-American; Low Birth Weight; Maternal Age; Prenatal Care; Poverty; Weathering
1252,African American; Breast Cancer; Case-Control Study; Polymorphism; Risk Factors
1253,Antihypertensive therapy; hypertension-related morbidity and mortality; coronary heart disease
1254,coronary heart disease; hypertension; cholesterol; cardiovascular disease prevention
1255,antihypertensive therapy; hypertension; health care costs
1256,lipid-lowering trial; hypertension study; pravastatin
1257,U.S. health care system; racial and socioeconomic disparities; racial minorities; low-income populations
1258,Breast Cancer Chemoprevention; Selective Estrogen Receptor Modulators
1259,African American; Breast Cancer; Case-Control Study; Polymorphism; Risk Factors
1260,Acculturation; Cervical Neoplasms; Health Behavior; Hispanic Americans; Native Americans; Papanicolaou Test
1261,Colorectal Cancer; Cancer Screening; Sigmoidoscopy; Colonoscopy; Proctoscopy; Fecal Occult Blood Test
1262,African-American Men; Digital Rectal Exam; Focus Groups; Health Beliefs; Prostate Cancer Screening; PSA
1263,Adolescent; Ethnicity; Metabolism; Nicotine; Smoking
1264,Age Factors; Prostate Cancer; Prostate-Specific Antigen; Race; Screening
1265,Colorectal Neoplasm/Prevention and Control; Hispanic; Insurance; MeSH; Primary Health Care; Safety Net
1266,Asian Pacific Islanders; Ethnicity; HIV Disease Progression; Socioeconomic Factors
1267,Antibiotics; Attitudes; Ethnicity; Knowledge; Upper Respiratory Infection; Use
1268,African-American; Food Security; Fruit and Vegetables; Neighborhood; Nutrition; Racial Residential Segregation; Socioeconomic Status
1269,African Americans; Chronic Diseases; Indigenous Populations; Stress
1270,
1271,racial under-representation; clinical trials; public health practitioners
1272,Behavioral Risk Factor Surveillance System; Racism; Self rated Health
1274,Health Indicators; health care; race and ethnicity; socioeconomic status
1275,Individual and population causes of disease; Social determinants of health; NICE; Inequalities in health; Life course; Lifeworld
1276,women; racial and ethnic minorities; human research; clinical research; institutional bias 
1277,African American parents; Parental distrust; medical research; African American children; clinical research.
1278,Social Determinants of Health
1279,African American; Aging; Cardiovascular Reactivity; Caregiving; Cortisol; Race Differences; Women
1280,Control; Ethnic Differences; Hypertension; Prevalence; Treatment
1281,disparities race discrimination
1282,
1283,
1284,prisons; prisoners; prison - industrial complex; Black; Latino; drugs; alcohol; community-centered approach; incarceration; rehabilitation; racial disparities
1285,incarceration rates; sexually transmitted infections; teenage pregnancies; destabilizing communities; adverse health outcomes
1286,Incarceration; War on Drugs; Public Health; nonviolent drug-related crimes; health disparities; people of color; public health policy changes; families of color; urban communities
1287,
1288,Agent Based Modeling; Social Networks
1289,Computational models; Agent-based models; Information Sharing
1290,Agent-based models; influenza epidemic; social networks
1291,Agent-based models; Social networks; opinion change
1292,computer simulation; social networks; simulation models
1293,Agent-based Models
1294,agent-based model 
1295,bioterrorism; computer simulation contact; tracing mass vaccination models; theoretical smallpox vaccinia
1296,Agent-Based Model
1297,Decision making; heuristics; networks; market dynamics
1298,social networks computer model
1299,agent; information sharing; multi-agent systems; reputation; trust
1300,prejudice game theory model; theoretical contact hypothesis
1301,Game Theory modeling; Contact Hypothesis
1302,Game theory; Prisoner’s Dilemma; Prejudice; Tit for Tat; Robustness
1304,race models
1306,
1307,
1310,sexually transmitted diseases; syphilis studies; Gonorrhea studies; experiments; ethics; medical; Guatemala; history of medicine; human rights abuses; infection; research subjects; John C. Cutler
1312,sexually transmitted diseases; Guatemala; syphilis studies; Gonorrhea studies; experiments; ethics; medical; Guatemala; history of medicine; human rights abuses; infection; research subjects; John Cutler
1313,socio-economic status; food security; access to food outlets; Preschool Children; Obesity
1314,County Health Rankings; state reports; health outcomes; health behaviors; clinical care; social factors; economic factors; physical environment
1315,
1316,coronary atherosclerosis; race; acute myocardial infarction; unstable angina; acute coronary syndromes
1317,qualitative; focus groups; Texas-Mexico border; HPV; cervical cancer; Pap test; Hispanics; Latinos; fatalism; machismo; cultural beliefs
2392,
2393,sexually transmitted diseases; STD; deliberate exposure; John C. Cutler; Guatemala; syphilis studies; syphilis
2394,unauthorized experimentation; research; blood samples; biologic materials; Havasupai Tribe
2395,Havasupai Indian tribe; genetic research; informed consent; biospecimens; 
2396,
2399,health inequalities; social determinants of health; 
2400,public health; Social Determinants of Health; health equity 
2401,social determinants of health; health equity; population health;  government; New Zealand
2402,sodium; public health; national dietary guidelines; elevated blood pressure
2403,chronic diseases; life expectancy; ethnic differences; Health Disparities
2404,Dietary Guidelines for Americans; sodium; hypertension; diabetes; chronic kidney disease; African-American; racial disparities in health; salt sensitivity
2406,syphilis; President Clinton; APOLOGY; Tuskegee; Tuskegee syphilis experiment.
2407,agriculture; children; cognitive development; farmworker; insecticides; intelligence quotient; neurodevelopment; organophosphate; pesticides
2409,environmental exposures; IQ; mental development; Organophosphates; pesticides
2412,
2413,
2414,discrimination; perceived discrimination; race-related exclusion; 
2415,obesity; 4-year-old US children; Racial/ethnic disparities;  Prevalence of obesity; Racial/ethnic group
2416,cigarette smoking; smoking prevention and cessation; racial/ethnic minority groups; clinical interventions; pharmacotherapy
2417,smoking prevalence; disparities; race/ethnicity; socioeconomic status; health disparities; disparities in life expectancy
2418,nicotine metabolism; cessation drug therapy; genetics of nicotine dependence; race/ethnic group
2419,Tobacco Use; Smoking Cessation; Health Disparities; Minority Health; African-Americans; Latinos; Native Americans; Asian-Americans; Prevention Research
2420,Tobacco Cessation; Youth; Mental Health; Addictions; Community Treatment; Prevention Research
2421, Disparities; Race; Minority; Socioeconomic; Education; Tobacco; Smoking; Cessation; Quit; Media; Campaign; Prevention Research
2422,Disparity; African-American; Quitline; Help-Seeking; Quit Attempt; Media; Prevention Research
2423,Smoking Cessation; Quitline; Disparities; Intention; Prevention Research
2424,American Indians; Tobacco Cessation; Evaluation
2425,Tobacco; Cessation; Asian; Chinese; Korean; Vietnamese; Prevention Research
2426,Pregnant Women; Smoking Cessation; Low Socioeconomic Status; Risk Factors; Prevention Research
2427,Tobacco; Secondhand Smoke; Hispanic; Latino; Multiunit Housing; Apartment; Prevention Research
2428,Acculturation; Smoking Behavior; Latinos; Puerto Ricans; Dominicans; Hispanic Americans; Non-Latino Whites; Smoking Cessation; Medically Underserved; Prevention Research
2429,Latino-Americans; Smoking Cessation; Social Support; Partner Support; Depression; Spouse; Prevention Research
2430,Cigarette Smoking; Hispanic Americans; Culture; Acculturation; Smoking Cessation; Prevention Research; Colorado
2431,
2432,
2433,universal health care; health equity; health reform; social determinants; education; poverty reduction; preventive measures; human rights; public health; policy
2434,
2436,tobacco smoke; cardiovascular disease; smoking ban; New York State; acute myocardial infarction; stroke; smoking restrictions
2437,
2439,prenatal care; cigarette smoking; Hispanic women; acculturation; pregnancy
2440,
2442,
2443,
2444,
2445,
2446,Havasupai tribe; Native American; AZ; bioethics
2449,
2451,
2452,
2453,National Negro Health Week
2454,National Negro Health Week; Booker T. Washington; TuskegeeInstitute 
2455,National Negro Health Week; Booker T. Washington; Tuskegee Negro Conference
2456,National Negro Health Week
2457,National Public Health Week; built environment; children’s health; Child and Adolescent Health; Environment; Exercise/Physical Activity; Injury/Emergency Care/Violence; Nutrition/Food; Obesity; Overweight; Underweight 
2458,National Negro Health Week
2459,National Negro Health Week
2460,National Negro Health Week
2461,National Negro Health Week
2462,
2463,
2466,
2468,Guatemala; sexually transmitted diseases; John Cutler; Sexually Transmitted Disease Inoculation Study 
2469,Sexually Transmitted Disease (STD) Inoculation Study; John C. Cutler; Guatemala; sexually transmitted diseases; syphilis studies; Gonorrhea studies; experiments; ethics; medical;  human rights abuses; infection; research subjects
2470,ethics; medical; Guatemala; history of medicine; human rights abuses; infection; research subjects; sexually transmitted diseases; John Cutler
2471,
2472,timeline; cancer; disparities
2473,
2474,
2475,
2477,
2478,
2479,
2480,
2482,Melanin; Smoking; Tobacco; Nicotine; African-Americans; Blacks; Skin color
2483,Smoking; African American; FTND; CDS; NDSS; Scale validity
2484,First Annual Minority Health Leadership Summit
2485,health disparities; critical race theory; public health critical race praxis;racial and ethnic minorities; community engagement
2487,nutrition; racial disparities; access to healthy food
2488,health care service utilization; participation in medical research; race; social support
2489,depression; racial differences; problem-solving therapy
2490,vitamin D; Seasonal variation; vitamin D sufficiency
2491,race/ethnicity; coronary artery disease; type 2 diabetes (diabetes mellitus);
2493,risk factors; depression; depression prevention 
2494,community-based participatory research; local collaborative; maternal and child healthcare; systems change
2495,self-assessment of health; type 2 diabetes; coronary artery disease
2496,Guatemala; Guatemala syphilis study
2497,Guatemalan Inoculation Study Susan Reverby John Cutler 
2499,clinical research; Racial differences; societal distrust 
2500,racism; diabetes
2501,social support; stress; hypertension; depression
2502,hypertension; stress; depression; social support 
2503,reducing health disparities; racial and ethnic minorities
2504,
2505,obesity; black women; neighborhood urban form; weight change 
2506,hypertension; Depression; cardiovascular disease
2507,depressive symptoms; social support; blood pressure 
2508,disparities; genetic testing; cancer risk
2509,physical activity; cancer risk; racial/ethnic disparities 
2510,race/ethnicity; clinical trial awareness
2511,racial differences; shared decision making; health disparities; communication disparities; diabetes
2512,bidirectional dialogue; treatment plans; racial disparities; diabetes
2514,National Negro Health Week;  Booker T. Washington
2515,Research in the emergency setting; Exemption from consent; Research ethics; Subject selection; Clinical trials; Trauma; Race and ethnicity
2516,age factors; blacks; elderly; ethnic groups; hispanic americans; men; neoplasms; patient selection; race; randomized trials; research; women's health
2518,
2519,diabetes; dietary patterns; dietary change program 
2520,depression treatment; glycemic control; depression outcomes; Older African Americans; type 2 diabetes mellitus treatment 
2521,
2523,health care-related distrust; racial disparities; racial differences in distrust; multidimensional trust
2524,1918 influenza epidemic; racial barriers in medicine
2525,African Americans; American Medical Association; blacks; civil rights; history of medicine; minority groups; physicians; prejudice; race; societies; medical; United States
2526,racism; health outcomes; wage discrimination
2527,Equity; health disparities; discrimination; Allostatic load;  environmental stressors
2528,allostasis;allostatic load;cardiovascular disease;nursing;resilience;stress
2529,Tuskegee Syphilis Experiment; Tuskegee; intellectual property; syphilis; clinical study
2530,Tuskegee Study of Untreated Syphilis; research; ethics; syphilis; Tuskegee
2531,core competencieshealth disparitiesneeds assessmentpublic health workforce training
2532,race/ethnicity; disparities; nicotine replacement therapy (NRT); adolescent smokers; smoking cessation treatment
2533,community health worker; health disparities; volunteer; paid staff 
2534,health disparity; barbershop-based health promotion; Black Barbershop Health Outreach Program
2535,Diabetes Mellitus; Self-care;Healthcare Disparities; Minority Health; Income
2536,Insulin Resistance; Stress; Ethnicity;Coping Style
2537,stress hormones - obesity - glucocorticoid receptor - adrenal hormones - HOMA
2538,insulin resistant; hyperinsulinemia; African-American adolescents; 
2539,insulin sensitivity; metabolic health
2540,insulin sensitivity; metabolic risk; overweight Latino youth; glycemic response
2541,metabolic risk factors; Latino youth; dietary intake; fiber intakes; visceral adiposity
2542,breakfast consumption; overweight Latino youth; type 2 diabetes; insulin dynamics 
2543,Obesity; Overweight; Adventists;College Students
2544,Diabetes Mellitus; AfricanAmericans; Blood Glucose; Health StatusDisparities; Veterans 
2545,Diabetes; Faith-based; LifestyleIntervention; Physical Activity; CommunitybasedParticipatory Research
2546,faith-based diabetes prevention program; community-based participatory approach; African-American church; behavioral lifestyle interventions; faith-based setting
2547,Stroke; Heart Attack; Risk Factors;Warning Signs; Awareness; Race; Disparity
2548,physical activity; quality of life; racial/ethnic groups; middle-aged women 
2549,Population science; special populations; blood pressure measurement/monitoring; African Americans; hypertension
2550,Barbershop-based outreach programs; hypertension; black men;  high blood pressure 
2551,Anxiety; Depression; Sleep onset latency; Emotional eating; Mediation
2552,smoking; American Indians; cultural identification 
2553,health care disparities; ethnic groups; Hispanic Americans; African Americans; Asian Americans; Indians; North American 
2554,discrimination; race; emotional stress help-seeking
2555,discrimination; health care utilization; health disparities; adherence
2556,
2557,aging; research
2558,obesity; body mass; occupational standing; employment-baseddiscrimination; career trajectories
2559,Physical Fitness; anaerobic power; V.O2max; Body Fat; fishermen; Harvard Step Test 
2560,Mortality; Race/ethnicity; Social class; Health disparities; Public health; Neighborhoods; USA
2562,HIV/AIDS; highly active antiretroviral therapy; socioeconomic status; racial disparities 
2563,African Americans; blacks; cause of death; European continental ancestry group; life expectancy; public health; race; United States
2564,African American men; routine health examinations; psychosocial factors; medical mistrust; male social networks
2565,medical mistrust; African American men; racism in healthcare
2566,Trust;cultural mistrust;satisfaction;nurse-managed clinic
2567,cultural mistrust; medical mistrust; racial identity; primary-care nurse practitioners 
2568,health disparities 
2569,disparities; race; ethnicity; language data
2570,depression; African Americans; healthcare disparities; patient; physician communication 
2571,CRC screening; racial/ethnic disparities; Medicare
2572,African Americans; colorectal cancer; disparities; screening; narrative health promotion
2573,overweight; obesity; African-American and Hispanic children;  Poverty; well child check-ups 
2574,life expectancy; mortality; Racial disparities; life expectancy at birth; infant and child mortality
2575,Cultural proficiency; Health disparities; Community-based research platform
2576,diabetes mellitus; risk factors; GDM prevention studies; Hispanic women; research participation
2577,clinical research; distrust; minorities; health disparities;  community involvement
2578,Recruiting and retaining minorities; rural community health center; trust; ethnically diverse study participants
2579,intervention research; health disparities; distrust; Community-based participatory research; building trust 
2580,community-based participatory research (CBPR); data analysis and interpretation; community partners 
2581,Community advisory boards; risks and benefits; informed consent; research
2582,human experimentation; biomedical research; protection of communities
2583,Biomedical ethics; Common Rule; family history information; federal regulations; human genetics research; informed consent
2584,patient satisfaction; medical mistrust; racial attitudes; utilization of health care
2585,minority; older adults; mistrust; trust; clinical research
2586,racial disparities; access to health services; quality in health care; disparity; African Americans 
2587,health insurance; racial/ethnic minorities; health insurance disparities; hospital consolidation
2588,health disparities; equitable access to healthy foods; obesity 
2589,obesity; policy; physical activity; food environments; diet
2590,racial and economic health disparities; access to healthy foods; racial and income neighborhood composition
2591,neighborhood racial composition; poverty; supermarkets; African Americans; Racial residential segregation 
2592,inequalities in health; urban health initiatives; AfricanAmericans; racism
2593,diversity; health professions; policy; civil rights
2594,Poverty; food insecurity; obesity; education; income; energy density; food costs; added sugar; added fat; palatability; socioeconomic status 
2595,people of color; access to health care; disparities; Patient Protection and Affordable Care Act; health reform
2596,Black Barbershop Health Outreach Program; health screenings; health education; diabetes; high blood pressure; prostate cancer 
2597,breast cancer; socioeconomic status; obesity; disparities
2598,African-American women; knowledge; health promoting behaviors 
2599,African American women; breast cancer; breast cancer education intervention
2600,immunization rates; reminders; recall; disparities
2601,access to health carehealth; insurance; children; minorities; racial disparities; race; ethnicity; SCHIP; uninsured
2602,congenital heart defects; race/ethnicity; mortality; survival; childhood
2603, health services research; national longitudinal data; health care quality; disparities 
2604,Ethnic groups; Obesity prevention; Obesity treatment; Clinical trials; BMI; Systematic review; Metaanalysis; Health disparities; Cultural issues; Environmental context
2605,Adults; Minority; Review; Obesity; Interventions
2606,social networks; public health threats; the Starr Centre; the Whittier Centre; health promotion; Black communities
2607,tax incentives; physical activity; obesity; Children's Fitness Tax Credit
2608,Community interventions; public health; conceptualization of health issues
2609,Diabetes Prevention Program; community application; standardized research methodology; multisite translational community trial (mTCT); community based participatory research 
2610,Neighborhood aesthetics; social involvement; community garden participation; community gardens
2611,behavioral theory-based community health worker intervention; community-based participatory research; community health workers; health care delivery
2612,health impact assessment methods; sodium content; sodium-reduction strategies; hypertension; food-procurement policy; sodium-reduction analysis 
2613,risk estimates of mortality; deaths attributable to social factors
2614,community-wide interventions; randomized controlled trials (RCTs); community-based participatory research (CBPR); community health advisors; translational research
2615,academic public health; chronic disease prevention; global public health issue 
2616,Conditional cash transfer schemes; social determinants framework; participants' health and nutritional status;  educational attainment
2617,National School Lunch Program; Unsubsidized meals; subsidized low-income students 
2618,Health care reform;   public insurance; access; disparities; private insurance; children
2619,life expectancy; socioeconomic inequalities in health;  health disparities; interventions; policy
2620,risk factors; psychological and social factors; social support; physical exercise;  middle-aged and older adults; functional health 
2621,active travel; physical activity; obesity; diabetes; walking; cycling; daily travel
2622,peer-driven intervention; screening; AIDS clinical trials; African Americans; Hispanics;  HIV/AIDS
2623,health inequities; social epidemiology; community-engaged interventions; transdisciplinary training; practice
2624,childhood mortality; racial disparities;  Medicaid; State Children's Health Insurance Program (SCHIP)
2625,Health disparities; health equity; health care system;  health disparity communities; National Center on Minority Health and Health Disparities (NCMHD)
2626,National Institutes of Health (NIH); NIH Summit; health disparities research; health disparities 
2627,Health disparities; race/ethnicity; socioeconomic class; bioethics
2628,socioeconomic disparities; racial/ethnic disparity 
2629,smoking cessation; lung cancer; African American; mentholated cigarettes; Latino
2630,mortality; longevity; male mortality 
2631,Stroke; Mortality; Race/Ethnicity;Veterans
2632,self-reported racism; cancer-related health behaviors; racism; race/ethnicity
2633,risk of diabetes; socioeconomic position; diabetes
2634,racial/ethnic discrimination; mental health problems; racial/ethnic discrimination; mental health disorders
2635,self-reported hypertension; Hispanics; hypertension; health disparities; race
2636,racial and ethnic disparities; medication therapy management (MTM); Medicare beneficiaries
2637,Trust; mistrust; help seeking; underutilization; measurement;scale; factor analysis; principle components analysis
2638,Race/ethnicity; insurance; emergency department; wait time
2639,Racial disparities; health care expenditures; quantile regression; vigicile
2640,Access; insurance; immigrant; Hispanic; community
2641,Racial disparities; revascularization; acute myocardial infarction; risk adjustment
2642,Lifestyle; obesity; ordinal probit; overweight; switching regression
2643,disparities; diabetes; uninsured;  Maryland; state policy
2644,disparities; Type II Diabetes; St. Lawrence County Rural Minority Health Project; racial and ethnic minorities 
2645,
2646,health disparities; racial and ethnic groups; University of Maryland School of Medicine; Maryland; financial incentives 
2647,Maryland Health Quality and Cost Council; Maryland; health disparities; racial minorities; barbershop engagement; financial and performance-based incentives 
2648,comparative effectiveness research (CER); Patient-Centered Outcomes Research Institute; health care
2649,African American women; type 2 diabetes; Together on Diabetes; health disparities
2650,
2651,clinical trials; national institutes of health; fact sheet; FAQ; research; 
2652,human genome sequence; personalized medicine; genetic susceptibility; pharmacogenetic testing; Individually tailored drugs; Health disparities; minorities; access to health care 
2653,health equity; human rights; health inequalities; social conditions 
2654,social determinants of health; health equity; power structure; rights-based approach to health
2655,racial and ethnic minorities; underserved populations; preventive care; health disparities; The Affordable Care Act; data collection 
